{
  "$schema": "https://json-schema.org/draft/2020-12/schema",
  "$id": "https://harness.local/provider-sdk-v1/fixture.schema.json",
  "title": "Harness Provider SDK Conformance Fixture v1",
  "type": "object",
  "required": ["schemaVersion", "name", "steps"],
  "additionalProperties": false,
  "properties": {
    "schemaVersion": {
      "const": 1
    },
    "name": {
      "type": "string",
      "minLength": 1
    },
    "description": {
      "type": "string"
    },
    "steps": {
      "type": "array",
      "minItems": 1,
      "items": {
        "oneOf": [
          {
            "type": "object",
            "required": ["send"],
            "additionalProperties": false,
            "properties": {
              "send": {
                "type": "object"
              }
            }
          },
          {
            "type": "object",
            "required": ["expect"],
            "additionalProperties": false,
            "properties": {
              "expect": {
                "type": "object"
              }
            }
          }
        ]
      }
    }
  }
}
